{
  "$schema": "http://json-schema.org/draft-04/schema#",
  "type": "object",
  "additionalProperties": false,
  "required": [
    "base_path",
    "format",
    "locale"
  ],
  "properties": {
    "base_path": {
      "type": "string"
    },
    "title": {
      "type": "string"
    },
    "description": {
      "type": "string"
    },
    "format": {
      "type": "string",
      "enum": [
        "unpublishing"
      ]
    },
    "public_updated_at": {
      "type": "string",
      "format": "date-time"
    },
    "locale": {
      "type": "string"
    },
    "need_ids": {
      "type": "array",
      "items": {
        "type": "string"
      }
    },
    "details": {
      "type": "object",
      "additionalProperties": false,
      "required": [
        "unpublished_at"
      ],
      "properties": {
        "explanation": {
          "type": [
            "string",
            "null"
          ]
        },
        "unpublished_at": {
          "type": "string",
          "format": "date-time"
        },
        "alternative_url": {
          "type": [
            "string",
            "null"
          ],
          "format": "uri"
        }
      }
    },
    "updated_at": {
      "type": "string",
      "format": "date-time"
    },
    "links": {
      "type": "object",
      "additionalProperties": false,
      "properties": {
        "available_translations": {
          "$ref": "#/definitions/frontend_links"
        }
      }
    }
  },
  "definitions": {
    "route": {
      "type": "object",
      "additionalProperties": false,
      "required": [
        "path",
        "type"
      ],
      "properties": {
        "path": {
          "type": "string"
        },
        "type": {
          "enum": [
            "prefix",
            "exact"
          ]
        }
      }
    },
    "frontend_links": {
      "type": "array",
      "items": {
        "type": "object",
        "additionalProperties": false,
        "properties": {
          "title": {
            "type": "string"
          },
          "base_path": {
            "type": "string"
          },
          "api_url": {
            "type": "string",
            "format": "uri"
          },
          "web_url": {
            "type": "string",
            "format": "uri"
          },
          "locale": {
            "type": "string"
          }
        }
      }
    }
  }
}
