{
  "base_path":"/government/case-studies/bubble-trouble",
  "title":"Bubble and trouble",
  "description":"A case study about bubble and trouble.",
  "format":"unpublishing",
  "need_ids":[

  ],
  "locale":"en",
  "updated_at":"2014-12-10T14:50:13.372Z",
  "public_updated_at":"2014-04-30T23:01:51.000+00:00",
  "details":{
    "explanation": "This is now redundant",
    "unpublished_at":"2014-05-01T14:59:17+01:00",
    "alternative_url": null
  },
  "links":{
    "available_translations":[
      {
        "title":"Bubble and trouble",
        "base_path":"/government/case-studies/bubble-trouble",
        "api_url":"http://content-store/content/government/case-studies/bubble-trouble",
        "web_url":"https://www.gov.uk/government/case-studies/bubble-trouble",
        "locale":"en"
      }
    ]
  }
}
